{"build":{"buildScript":"build","configurationPaths":["vite.config.ts"],"packageLockPath":"package-lock.json","packageManifestPath":"package.json","testScript":"test"},"closureMethod":"npm-package-lock-v3-static-module-closure-v1","githubActionsRunIds":["123456789"],"numericRepositoryId":"123456789","repositoryUri":"https://github.com/example-builder/example-game","revisionObjectId":"1111111111111111111111111111111111111111","runtimePaths":["index.html"],"schemaVersion":"2.0.0","sourcePaths":["src/main.ts"],"testPaths":["test/main.test.ts"],"treeObjectId":"2222222222222222222222222222222222222222"}
